{
  "$schema": "https://json-schema.org/draft/2020-12/schema",
  "title": "Evidence Review Pack Resolver Resolution",
  "type": "object",
  "additionalProperties": false,
  "required": ["schema_version", "review_id", "selected_run_id", "resolution_status", "canonicality", "load_source"],
  "properties": {
    "schema_version": { "const": "resolver_resolution.v1" },
    "review_id": { "type": "string", "minLength": 1 },
    "selected_run_id": { "type": "string", "minLength": 1 },
    "resolution_status": { "type": "string", "enum": ["resolved", "partial", "unresolved"] },
    "source_paths": {
      "type": "array",
      "items": { "$ref": "#/$defs/repositoryRelativePath" }
    },
    "resolved_sources": {
      "type": "array",
      "items": {
        "type": "object",
        "additionalProperties": false,
        "required": ["path", "kind", "fingerprint"],
        "properties": {
          "path": { "$ref": "#/$defs/repositoryRelativePath" },
          "kind": { "type": "string", "minLength": 1 },
          "fingerprint": { "type": "string", "pattern": "^[a-f0-9]{64}$" }
        }
      }
    },
    "missing_sources": {
      "type": "array",
      "items": { "$ref": "#/$defs/repositoryRelativePath" }
    },
    "source_fingerprint": {
      "type": ["string", "null"],
      "pattern": "^[a-f0-9]{64}$"
    },
    "warnings": {
      "type": "array",
      "items": { "type": "string" }
    },
    "canonicality": { "$ref": "#/$defs/canonicality" },
    "load_source": { "$ref": "#/$defs/loadSource" }
  },
  "$defs": {
    "repositoryRelativePath": {
      "type": "string",
      "pattern": "^(?!/)(?![A-Za-z]:)(?!.*\\\\)(?!.*://)(?!.*(^|/)\\.\\.(/|$)).+"
    },
    "canonicality": {
      "type": "object",
      "required": ["schema_version", "derived_class", "non_authoritative", "write_back_forbidden", "rebuildable"],
      "properties": {
        "schema_version": { "const": "canonicality.v1" },
        "derived_class": { "const": "review_pack" },
        "non_authoritative": { "const": true },
        "write_back_forbidden": { "const": true },
        "rebuildable": { "const": true }
      }
    },
    "loadSource": {
      "type": "object",
      "required": ["schema_version", "loaded_from", "canonical_source", "non_authoritative"],
      "properties": {
        "schema_version": { "const": "load_source.v1" },
        "loaded_from": { "const": "review_pack" },
        "canonical_source": { "const": "artifacts" },
        "non_authoritative": { "const": true }
      }
    }
  }
}
